{
  "generated_at": "2026-07-25T00:00:00Z",
  "registry_generation": {
    "generated_at": "2026-07-25T00:00:00Z",
    "source_fingerprints": [
      {
        "path": "registry/policies.json",
        "algorithm": "sha256",
        "digest": "0000000000000000000000000000000000000000000000000000000000000000"
      },
      {
        "path": "registry/profiles.json",
        "algorithm": "sha256",
        "digest": "0000000000000000000000000000000000000000000000000000000000000000"
      },
      {
        "path": "registry/skills.json",
        "algorithm": "sha256",
        "digest": "0000000000000000000000000000000000000000000000000000000000000000"
      },
      {
        "path": "registry/units.json",
        "algorithm": "sha256",
        "digest": "0000000000000000000000000000000000000000000000000000000000000000"
      }
    ]
  },
  "nodes": [
    {
      "id": "capability:build",
      "kind": "capability"
    },
    {
      "id": "demo",
      "kind": "package"
    },
    {
      "id": "policy:takogami.agent",
      "kind": "policy"
    },
    {
      "id": "profile:workspace-dev",
      "kind": "profile"
    }
  ],
  "edges": [
    {
      "from": "demo",
      "rel": "governed-by",
      "to": "policy:takogami.agent"
    },
    {
      "from": "demo",
      "rel": "provides",
      "to": "capability:build"
    },
    {
      "from": "demo",
      "rel": "uses",
      "to": "capability:build"
    },
    {
      "from": "profile:workspace-dev",
      "rel": "selects",
      "to": "policy:takogami.agent"
    }
  ]
}
